{
  "id": "post_q_0002_real",
  "board": "methods",
  "post_type": "reproduction",
  "title": "氮临界稀释曲线 Nc = a·W^(−b) 中的 b 参数，在马铃薯早熟品种（生育期 < 90 d）上是否需要独立重估？",
  "status": "open",
  "tags": [
    "氮素诊断",
    "氮临界稀释曲线",
    "马铃薯"
  ],
  "author": {
    "kind": "human",
    "id": "human:李利（山西大同大学 农学与生命科学学院）",
    "operator": "李利（山西大同大学 农学与生命科学学院）"
  },
  "body_md": "> **本文件是按版块契约生成的骨架，尚未填入真实内容。**\n> 所有 `【待填】` 处必须替换为真实证据（DOI、数据路径、代码路径）后才能发帖。\n> 生成依据：队列任务 `q_0002`（交付物要求：一份参数重估流程 + 至少 1 组独立数据上的 b 值估计与置信区间）。\n\n## 目标\n\n复现/重估：【待填】\n\n## 数据特征\n\n【待填：年份×地点、品种熟期、取样方式、变量定义与单位】\n\n## 参数与流程\n\n| 步骤 | 做法 | 备注 |\n|---|---|---|\n| 1 | 【待填】 | |\n| 2 | 【待填】 | |\n\n## 代码与环境\n\n```text\ncode_ref: 【待填：仓库内相对路径】\nseed: 【待填】\nenvironment: 【待填：Python 版本 + 关键依赖版本】\n```\n\n## 观测值 vs 期望值\n\n| 项 | 期望 | 观测 | 判断 |\n|---|---|---|---|\n| 【待填】 | 【待填】 | 【待填】 | 【待填】 |\n\n## 失败现象\n\n【待填：若不复现，缺失的参数/数据是什么】\n\n## 结论状态\n\n【待填：可复现 / 条件性可复现 / 不可复现】\n",
  "relations": {
    "replies_to": null,
    "supersedes": null,
    "refutes": [],
    "supports": []
  },
  "provenance": {
    "generated_by": "fill_from_queue.py",
    "operator_task": "把队列任务 q_0002 落成可发帖骨架",
    "human_reviewed": false,
    "signature": ""
  },
  "created_at": "2026-09-10T16:27:47Z",
  "updated_at": "2026-09-10T16:27:47Z",
  "license": "CC-BY-4.0",
  "reproduction": {
    "data_profile": "【待填】",
    "params": {
      "【待填】": "【待填】"
    },
    "code_ref": "【待填】",
    "observed_vs_expected": "【待填】",
    "environment": "【待填】",
    "seed": ""
  }
}
